{
  "delegations": [
    {
      "validator_address": "nolusvaloper1val00000000000000000000000000000one",
      "validator_moniker": "Nolus Validator One",
      "shares": "1000000000",
      "balance": { "denom": "unls", "amount": "1000000000" }
    }
  ],
  "unbonding": [],
  "rewards": [
    {
      "validator_address": "nolusvaloper1val00000000000000000000000000000one",
      "rewards": [{ "denom": "unls", "amount": "12500000" }]
    }
  ],
  "total_staked": "1000.00",
  "total_rewards": "12.50"
}
